{"generated_at":"2026-10-19T16:14:15+0000","season":2027,"basis":"regular_season_table","n_teams":10,"records":[{"team":"Fjölnir","placement":1,"probability":0},{"team":"Fjölnir","placement":2,"probability":0},{"team":"Fjölnir","placement":3,"probability":0},{"team":"Fjölnir","placement":4,"probability":0.00025},{"team":"Fjölnir","placement":5,"probability":0.00025},{"team":"Fjölnir","placement":6,"probability":0.00125},{"team":"Fjölnir","placement":7,"probability":0.00325},{"team":"Fjölnir","placement":8,"probability":0.02125},{"team":"Fjölnir","placement":9,"probability":0.2555},{"team":"Fjölnir","placement":10,"probability":0.71825},{"team":"Grindavík","placement":1,"probability":0.73675},{"team":"Grindavík","placement":2,"probability":0.15425},{"team":"Grindavík","placement":3,"probability":0.059},{"team":"Grindavík","placement":4,"probability":0.027},{"team":"Grindavík","placement":5,"probability":0.0145},{"team":"Grindavík","placement":6,"probability":0.005},{"team":"Grindavík","placement":7,"probability":0.003},{"team":"Grindavík","placement":8,"probability":0.0005},{"team":"Grindavík","placement":9,"probability":0},{"team":"Grindavík","placement":10,"probability":0},{"team":"Haukar","placement":1,"probability":0.0135},{"team":"Haukar","placement":2,"probability":0.09225},{"team":"Haukar","placement":3,"probability":0.12},{"team":"Haukar","placement":4,"probability":0.12825},{"team":"Haukar","placement":5,"probability":0.14975},{"team":"Haukar","placement":6,"probability":0.1535},{"team":"Haukar","placement":7,"probability":0.164},{"team":"Haukar","placement":8,"probability":0.15225},{"team":"Haukar","placement":9,"probability":0.02525},{"team":"Haukar","placement":10,"probability":0.00125},{"team":"KR","placement":1,"probability":0.02725},{"team":"KR","placement":2,"probability":0.0875},{"team":"KR","placement":3,"probability":0.12225},{"team":"KR","placement":4,"probability":0.153},{"team":"KR","placement":5,"probability":0.17475},{"team":"KR","placement":6,"probability":0.17375},{"team":"KR","placement":7,"probability":0.14925},{"team":"KR","placement":8,"probability":0.1015},{"team":"KR","placement":9,"probability":0.01},{"team":"KR","placement":10,"probability":0.00075},{"team":"Keflavík","placement":1,"probability":0.02775},{"team":"Keflavík","placement":2,"probability":0.1025},{"team":"Keflavík","placement":3,"probability":0.16725},{"team":"Keflavík","placement":4,"probability":0.18175},{"team":"Keflavík","placement":5,"probability":0.159},{"team":"Keflavík","placement":6,"probability":0.1425},{"team":"Keflavík","placement":7,"probability":0.112},{"team":"Keflavík","placement":8,"probability":0.09525},{"team":"Keflavík","placement":9,"probability":0.0115},{"team":"Keflavík","placement":10,"probability":0.0005},{"team":"Njarðvík","placement":1,"probability":0.1305},{"team":"Njarðvík","placement":2,"probability":0.29275},{"team":"Njarðvík","placement":3,"probability":0.2095},{"team":"Njarðvík","placement":4,"probability":0.14875},{"team":"Njarðvík","placement":5,"probability":0.104},{"team":"Njarðvík","placement":6,"probability":0.0575},{"team":"Njarðvík","placement":7,"probability":0.03875},{"team":"Njarðvík","placement":8,"probability":0.01675},{"team":"Njarðvík","placement":9,"probability":0.0015},{"team":"Njarðvík","placement":10,"probability":0},{"team":"Stjarnan","placement":1,"probability":0.01125},{"team":"Stjarnan","placement":2,"probability":0.053},{"team":"Stjarnan","placement":3,"probability":0.077},{"team":"Stjarnan","placement":4,"probability":0.09775},{"team":"Stjarnan","placement":5,"probability":0.131},{"team":"Stjarnan","placement":6,"probability":0.16675},{"team":"Stjarnan","placement":7,"probability":0.2135},{"team":"Stjarnan","placement":8,"probability":0.22375},{"team":"Stjarnan","placement":9,"probability":0.02475},{"team":"Stjarnan","placement":10,"probability":0.00125},{"team":"Tindastóll","placement":1,"probability":0.043},{"team":"Tindastóll","placement":2,"probability":0.17625},{"team":"Tindastóll","placement":3,"probability":0.16725},{"team":"Tindastóll","placement":4,"probability":0.15475},{"team":"Tindastóll","placement":5,"probability":0.13725},{"team":"Tindastóll","placement":6,"probability":0.12825},{"team":"Tindastóll","placement":7,"probability":0.1055},{"team":"Tindastóll","placement":8,"probability":0.0775},{"team":"Tindastóll","placement":9,"probability":0.01},{"team":"Tindastóll","placement":10,"probability":0.00025},{"team":"Valur","placement":1,"probability":0.01},{"team":"Valur","placement":2,"probability":0.0415},{"team":"Valur","placement":3,"probability":0.07775},{"team":"Valur","placement":4,"probability":0.10775},{"team":"Valur","placement":5,"probability":0.12875},{"team":"Valur","placement":6,"probability":0.166},{"team":"Valur","placement":7,"probability":0.1965},{"team":"Valur","placement":8,"probability":0.24875},{"team":"Valur","placement":9,"probability":0.0215},{"team":"Valur","placement":10,"probability":0.0015},{"team":"Ármann","placement":1,"probability":0},{"team":"Ármann","placement":2,"probability":0},{"team":"Ármann","placement":3,"probability":0},{"team":"Ármann","placement":4,"probability":0.00075},{"team":"Ármann","placement":5,"probability":0.00075},{"team":"Ármann","placement":6,"probability":0.0055},{"team":"Ármann","placement":7,"probability":0.01425},{"team":"Ármann","placement":8,"probability":0.0625},{"team":"Ármann","placement":9,"probability":0.64},{"team":"Ármann","placement":10,"probability":0.27625}],"summary":[{"team":"Fjölnir","p_top_of_table":0},{"team":"Grindavík","p_top_of_table":0.73675},{"team":"Haukar","p_top_of_table":0.0135},{"team":"KR","p_top_of_table":0.02725},{"team":"Keflavík","p_top_of_table":0.02775},{"team":"Njarðvík","p_top_of_table":0.1305},{"team":"Stjarnan","p_top_of_table":0.01125},{"team":"Tindastóll","p_top_of_table":0.043},{"team":"Valur","p_top_of_table":0.01},{"team":"Ármann","p_top_of_table":0}]}
