{"generated_at":"2026-10-16T18:09:42+0000","season":2026,"basis":"regular_season_table","n_teams":10,"records":[{"team":"Aþena","placement":1,"probability":1},{"team":"Aþena","placement":2,"probability":0},{"team":"Aþena","placement":3,"probability":0},{"team":"Aþena","placement":4,"probability":0},{"team":"Aþena","placement":5,"probability":0},{"team":"Aþena","placement":6,"probability":0},{"team":"Aþena","placement":7,"probability":0},{"team":"Aþena","placement":8,"probability":0},{"team":"Aþena","placement":9,"probability":0},{"team":"Aþena","placement":10,"probability":0},{"team":"Fjölnir","placement":1,"probability":0},{"team":"Fjölnir","placement":2,"probability":0},{"team":"Fjölnir","placement":3,"probability":1},{"team":"Fjölnir","placement":4,"probability":0},{"team":"Fjölnir","placement":5,"probability":0},{"team":"Fjölnir","placement":6,"probability":0},{"team":"Fjölnir","placement":7,"probability":0},{"team":"Fjölnir","placement":8,"probability":0},{"team":"Fjölnir","placement":9,"probability":0},{"team":"Fjölnir","placement":10,"probability":0},{"team":"KV","placement":1,"probability":0},{"team":"KV","placement":2,"probability":0},{"team":"KV","placement":3,"probability":0},{"team":"KV","placement":4,"probability":0},{"team":"KV","placement":5,"probability":0},{"team":"KV","placement":6,"probability":0},{"team":"KV","placement":7,"probability":0},{"team":"KV","placement":8,"probability":0},{"team":"KV","placement":9,"probability":1},{"team":"KV","placement":10,"probability":0},{"team":"Njardvik b","placement":1,"probability":0},{"team":"Njardvik b","placement":2,"probability":0},{"team":"Njardvik b","placement":3,"probability":0},{"team":"Njardvik b","placement":4,"probability":0},{"team":"Njardvik b","placement":5,"probability":0},{"team":"Njardvik b","placement":6,"probability":0},{"team":"Njardvik b","placement":7,"probability":0},{"team":"Njardvik b","placement":8,"probability":1},{"team":"Njardvik b","placement":9,"probability":0},{"team":"Njardvik b","placement":10,"probability":0},{"team":"Selfoss","placement":1,"probability":0},{"team":"Selfoss","placement":2,"probability":0},{"team":"Selfoss","placement":3,"probability":0},{"team":"Selfoss","placement":4,"probability":1},{"team":"Selfoss","placement":5,"probability":0},{"team":"Selfoss","placement":6,"probability":0},{"team":"Selfoss","placement":7,"probability":0},{"team":"Selfoss","placement":8,"probability":0},{"team":"Selfoss","placement":9,"probability":0},{"team":"Selfoss","placement":10,"probability":0},{"team":"Snæfell","placement":1,"probability":0},{"team":"Snæfell","placement":2,"probability":0},{"team":"Snæfell","placement":3,"probability":0},{"team":"Snæfell","placement":4,"probability":0},{"team":"Snæfell","placement":5,"probability":0},{"team":"Snæfell","placement":6,"probability":1},{"team":"Snæfell","placement":7,"probability":0},{"team":"Snæfell","placement":8,"probability":0},{"team":"Snæfell","placement":9,"probability":0},{"team":"Snæfell","placement":10,"probability":0},{"team":"Stjarnan b","placement":1,"probability":0},{"team":"Stjarnan b","placement":2,"probability":0},{"team":"Stjarnan b","placement":3,"probability":0},{"team":"Stjarnan b","placement":4,"probability":0},{"team":"Stjarnan b","placement":5,"probability":0},{"team":"Stjarnan b","placement":6,"probability":0},{"team":"Stjarnan b","placement":7,"probability":1},{"team":"Stjarnan b","placement":8,"probability":0},{"team":"Stjarnan b","placement":9,"probability":0},{"team":"Stjarnan b","placement":10,"probability":0},{"team":"Vestri","placement":1,"probability":0},{"team":"Vestri","placement":2,"probability":0},{"team":"Vestri","placement":3,"probability":0},{"team":"Vestri","placement":4,"probability":0},{"team":"Vestri","placement":5,"probability":0},{"team":"Vestri","placement":6,"probability":0},{"team":"Vestri","placement":7,"probability":0},{"team":"Vestri","placement":8,"probability":0},{"team":"Vestri","placement":9,"probability":0},{"team":"Vestri","placement":10,"probability":1},{"team":"ÍR","placement":1,"probability":0},{"team":"ÍR","placement":2,"probability":0},{"team":"ÍR","placement":3,"probability":0},{"team":"ÍR","placement":4,"probability":0},{"team":"ÍR","placement":5,"probability":1},{"team":"ÍR","placement":6,"probability":0},{"team":"ÍR","placement":7,"probability":0},{"team":"ÍR","placement":8,"probability":0},{"team":"ÍR","placement":9,"probability":0},{"team":"ÍR","placement":10,"probability":0},{"team":"Þór Ak.","placement":1,"probability":0},{"team":"Þór Ak.","placement":2,"probability":1},{"team":"Þór Ak.","placement":3,"probability":0},{"team":"Þór Ak.","placement":4,"probability":0},{"team":"Þór Ak.","placement":5,"probability":0},{"team":"Þór Ak.","placement":6,"probability":0},{"team":"Þór Ak.","placement":7,"probability":0},{"team":"Þór Ak.","placement":8,"probability":0},{"team":"Þór Ak.","placement":9,"probability":0},{"team":"Þór Ak.","placement":10,"probability":0}],"summary":[{"team":"Aþena","p_top_of_table":1},{"team":"Fjölnir","p_top_of_table":0},{"team":"KV","p_top_of_table":0},{"team":"Njardvik b","p_top_of_table":0},{"team":"Selfoss","p_top_of_table":0},{"team":"Snæfell","p_top_of_table":0},{"team":"Stjarnan b","p_top_of_table":0},{"team":"Vestri","p_top_of_table":0},{"team":"ÍR","p_top_of_table":0},{"team":"Þór Ak.","p_top_of_table":0}]}
