{"generated_at":"2026-10-28T15:11:29+0000","season":2027,"basis":"regular_season_table","n_teams":12,"records":[{"team":"Grindavík","placement":1,"probability":0.029},{"team":"Grindavík","placement":2,"probability":0.06875},{"team":"Grindavík","placement":3,"probability":0.0965},{"team":"Grindavík","placement":4,"probability":0.1305},{"team":"Grindavík","placement":5,"probability":0.156},{"team":"Grindavík","placement":6,"probability":0.1575},{"team":"Grindavík","placement":7,"probability":0.14625},{"team":"Grindavík","placement":8,"probability":0.1085},{"team":"Grindavík","placement":9,"probability":0.06775},{"team":"Grindavík","placement":10,"probability":0.0315},{"team":"Grindavík","placement":11,"probability":0.0075},{"team":"Grindavík","placement":12,"probability":0.00025},{"team":"Höttur","placement":1,"probability":0.0045},{"team":"Höttur","placement":2,"probability":0.01825},{"team":"Höttur","placement":3,"probability":0.027},{"team":"Höttur","placement":4,"probability":0.04625},{"team":"Höttur","placement":5,"probability":0.06225},{"team":"Höttur","placement":6,"probability":0.08},{"team":"Höttur","placement":7,"probability":0.12925},{"team":"Höttur","placement":8,"probability":0.2065},{"team":"Höttur","placement":9,"probability":0.21075},{"team":"Höttur","placement":10,"probability":0.1585},{"team":"Höttur","placement":11,"probability":0.0495},{"team":"Höttur","placement":12,"probability":0.00725},{"team":"KR","placement":1,"probability":0.17525},{"team":"KR","placement":2,"probability":0.183},{"team":"KR","placement":3,"probability":0.17525},{"team":"KR","placement":4,"probability":0.1425},{"team":"KR","placement":5,"probability":0.11025},{"team":"KR","placement":6,"probability":0.0895},{"team":"KR","placement":7,"probability":0.0665},{"team":"KR","placement":8,"probability":0.03275},{"team":"KR","placement":9,"probability":0.01875},{"team":"KR","placement":10,"probability":0.006},{"team":"KR","placement":11,"probability":0.00025},{"team":"KR","placement":12,"probability":0},{"team":"Keflavík","placement":1,"probability":0.0625},{"team":"Keflavík","placement":2,"probability":0.0955},{"team":"Keflavík","placement":3,"probability":0.125},{"team":"Keflavík","placement":4,"probability":0.1365},{"team":"Keflavík","placement":5,"probability":0.13625},{"team":"Keflavík","placement":6,"probability":0.145},{"team":"Keflavík","placement":7,"probability":0.1255},{"team":"Keflavík","placement":8,"probability":0.091},{"team":"Keflavík","placement":9,"probability":0.05025},{"team":"Keflavík","placement":10,"probability":0.02775},{"team":"Keflavík","placement":11,"probability":0.0045},{"team":"Keflavík","placement":12,"probability":0.00025},{"team":"Njarðvík","placement":1,"probability":0.0005},{"team":"Njarðvík","placement":2,"probability":0.003},{"team":"Njarðvík","placement":3,"probability":0.008},{"team":"Njarðvík","placement":4,"probability":0.01475},{"team":"Njarðvík","placement":5,"probability":0.03225},{"team":"Njarðvík","placement":6,"probability":0.051},{"team":"Njarðvík","placement":7,"probability":0.0925},{"team":"Njarðvík","placement":8,"probability":0.15425},{"team":"Njarðvík","placement":9,"probability":0.19325},{"team":"Njarðvík","placement":10,"probability":0.266},{"team":"Njarðvík","placement":11,"probability":0.13825},{"team":"Njarðvík","placement":12,"probability":0.04625},{"team":"Sindri","placement":1,"probability":0},{"team":"Sindri","placement":2,"probability":0.00075},{"team":"Sindri","placement":3,"probability":0.001},{"team":"Sindri","placement":4,"probability":0.00025},{"team":"Sindri","placement":5,"probability":0.00125},{"team":"Sindri","placement":6,"probability":0.00325},{"team":"Sindri","placement":7,"probability":0.00975},{"team":"Sindri","placement":8,"probability":0.0195},{"team":"Sindri","placement":9,"probability":0.065},{"team":"Sindri","placement":10,"probability":0.1375},{"team":"Sindri","placement":11,"probability":0.4375},{"team":"Sindri","placement":12,"probability":0.32425},{"team":"Stjarnan","placement":1,"probability":0.02775},{"team":"Stjarnan","placement":2,"probability":0.0695},{"team":"Stjarnan","placement":3,"probability":0.10225},{"team":"Stjarnan","placement":4,"probability":0.13475},{"team":"Stjarnan","placement":5,"probability":0.1565},{"team":"Stjarnan","placement":6,"probability":0.1535},{"team":"Stjarnan","placement":7,"probability":0.14225},{"team":"Stjarnan","placement":8,"probability":0.1045},{"team":"Stjarnan","placement":9,"probability":0.0635},{"team":"Stjarnan","placement":10,"probability":0.03725},{"team":"Stjarnan","placement":11,"probability":0.00775},{"team":"Stjarnan","placement":12,"probability":0.0005},{"team":"Tindastóll","placement":1,"probability":0.264},{"team":"Tindastóll","placement":2,"probability":0.22525},{"team":"Tindastóll","placement":3,"probability":0.16375},{"team":"Tindastóll","placement":4,"probability":0.1185},{"team":"Tindastóll","placement":5,"probability":0.08275},{"team":"Tindastóll","placement":6,"probability":0.0655},{"team":"Tindastóll","placement":7,"probability":0.04625},{"team":"Tindastóll","placement":8,"probability":0.02},{"team":"Tindastóll","placement":9,"probability":0.00975},{"team":"Tindastóll","placement":10,"probability":0.00425},{"team":"Tindastóll","placement":11,"probability":0},{"team":"Tindastóll","placement":12,"probability":0},{"team":"Valur","placement":1,"probability":0.09},{"team":"Valur","placement":2,"probability":0.12525},{"team":"Valur","placement":3,"probability":0.15325},{"team":"Valur","placement":4,"probability":0.1485},{"team":"Valur","placement":5,"probability":0.15625},{"team":"Valur","placement":6,"probability":0.12875},{"team":"Valur","placement":7,"probability":0.10075},{"team":"Valur","placement":8,"probability":0.055},{"team":"Valur","placement":9,"probability":0.0315},{"team":"Valur","placement":10,"probability":0.0095},{"team":"Valur","placement":11,"probability":0.001},{"team":"Valur","placement":12,"probability":0.00025},{"team":"Álftanes","placement":1,"probability":0.345},{"team":"Álftanes","placement":2,"probability":0.206},{"team":"Álftanes","placement":3,"probability":0.13575},{"team":"Álftanes","placement":4,"probability":0.104},{"team":"Álftanes","placement":5,"probability":0.0715},{"team":"Álftanes","placement":6,"probability":0.06125},{"team":"Álftanes","placement":7,"probability":0.0415},{"team":"Álftanes","placement":8,"probability":0.01975},{"team":"Álftanes","placement":9,"probability":0.009},{"team":"Álftanes","placement":10,"probability":0.0055},{"team":"Álftanes","placement":11,"probability":0.0005},{"team":"Álftanes","placement":12,"probability":0.00025},{"team":"Ármann","placement":1,"probability":0},{"team":"Ármann","placement":2,"probability":0},{"team":"Ármann","placement":3,"probability":0},{"team":"Ármann","placement":4,"probability":0.001},{"team":"Ármann","placement":5,"probability":0.00025},{"team":"Ármann","placement":6,"probability":0.00075},{"team":"Ármann","placement":7,"probability":0.003},{"team":"Ármann","placement":8,"probability":0.00975},{"team":"Ármann","placement":9,"probability":0.035},{"team":"Ármann","placement":10,"probability":0.0735},{"team":"Ármann","placement":11,"probability":0.2715},{"team":"Ármann","placement":12,"probability":0.60525},{"team":"ÍR","placement":1,"probability":0.0015},{"team":"ÍR","placement":2,"probability":0.00475},{"team":"ÍR","placement":3,"probability":0.01225},{"team":"ÍR","placement":4,"probability":0.0225},{"team":"ÍR","placement":5,"probability":0.0345},{"team":"ÍR","placement":6,"probability":0.064},{"team":"ÍR","placement":7,"probability":0.0965},{"team":"ÍR","placement":8,"probability":0.1785},{"team":"ÍR","placement":9,"probability":0.2455},{"team":"ÍR","placement":10,"probability":0.24275},{"team":"ÍR","placement":11,"probability":0.08175},{"team":"ÍR","placement":12,"probability":0.0155}],"summary":[{"team":"Grindavík","p_top_of_table":0.029},{"team":"Höttur","p_top_of_table":0.0045},{"team":"KR","p_top_of_table":0.17525},{"team":"Keflavík","p_top_of_table":0.0625},{"team":"Njarðvík","p_top_of_table":0.0005},{"team":"Sindri","p_top_of_table":0},{"team":"Stjarnan","p_top_of_table":0.02775},{"team":"Tindastóll","p_top_of_table":0.264},{"team":"Valur","p_top_of_table":0.09},{"team":"Álftanes","p_top_of_table":0.345},{"team":"Ármann","p_top_of_table":0},{"team":"ÍR","p_top_of_table":0.0015}]}
