{"generated_at":"2026-10-19T16:14:18+0000","season":2027,"basis":"regular_season_table","n_teams":12,"records":[{"team":"Afturelding","placement":1,"probability":0.09225},{"team":"Afturelding","placement":2,"probability":0.17475},{"team":"Afturelding","placement":3,"probability":0.29125},{"team":"Afturelding","placement":4,"probability":0.24525},{"team":"Afturelding","placement":5,"probability":0.12175},{"team":"Afturelding","placement":6,"probability":0.04175},{"team":"Afturelding","placement":7,"probability":0.01825},{"team":"Afturelding","placement":8,"probability":0.009},{"team":"Afturelding","placement":9,"probability":0.00425},{"team":"Afturelding","placement":10,"probability":0.001},{"team":"Afturelding","placement":11,"probability":0.00025},{"team":"Afturelding","placement":12,"probability":0.00025},{"team":"FH","placement":1,"probability":0.264},{"team":"FH","placement":2,"probability":0.36775},{"team":"FH","placement":3,"probability":0.21775},{"team":"FH","placement":4,"probability":0.09825},{"team":"FH","placement":5,"probability":0.0375},{"team":"FH","placement":6,"probability":0.01125},{"team":"FH","placement":7,"probability":0.0025},{"team":"FH","placement":8,"probability":0.001},{"team":"FH","placement":9,"probability":0},{"team":"FH","placement":10,"probability":0},{"team":"FH","placement":11,"probability":0},{"team":"FH","placement":12,"probability":0},{"team":"Fram","placement":1,"probability":0.00025},{"team":"Fram","placement":2,"probability":0.00125},{"team":"Fram","placement":3,"probability":0.00625},{"team":"Fram","placement":4,"probability":0.02825},{"team":"Fram","placement":5,"probability":0.0785},{"team":"Fram","placement":6,"probability":0.13425},{"team":"Fram","placement":7,"probability":0.177},{"team":"Fram","placement":8,"probability":0.16725},{"team":"Fram","placement":9,"probability":0.14625},{"team":"Fram","placement":10,"probability":0.117},{"team":"Fram","placement":11,"probability":0.0885},{"team":"Fram","placement":12,"probability":0.05525},{"team":"HK","placement":1,"probability":0},{"team":"HK","placement":2,"probability":0},{"team":"HK","placement":3,"probability":0.001},{"team":"HK","placement":4,"probability":0.00275},{"team":"HK","placement":5,"probability":0.01475},{"team":"HK","placement":6,"probability":0.05675},{"team":"HK","placement":7,"probability":0.0945},{"team":"HK","placement":8,"probability":0.148},{"team":"HK","placement":9,"probability":0.1725},{"team":"HK","placement":10,"probability":0.1905},{"team":"HK","placement":11,"probability":0.2},{"team":"HK","placement":12,"probability":0.11925},{"team":"Haukar","placement":1,"probability":0.555},{"team":"Haukar","placement":2,"probability":0.25575},{"team":"Haukar","placement":3,"probability":0.12325},{"team":"Haukar","placement":4,"probability":0.044},{"team":"Haukar","placement":5,"probability":0.017},{"team":"Haukar","placement":6,"probability":0.00425},{"team":"Haukar","placement":7,"probability":0.0005},{"team":"Haukar","placement":8,"probability":0},{"team":"Haukar","placement":9,"probability":0},{"team":"Haukar","placement":10,"probability":0},{"team":"Haukar","placement":11,"probability":0.00025},{"team":"Haukar","placement":12,"probability":0},{"team":"KA","placement":1,"probability":0.011},{"team":"KA","placement":2,"probability":0.0325},{"team":"KA","placement":3,"probability":0.082},{"team":"KA","placement":4,"probability":0.18725},{"team":"KA","placement":5,"probability":0.32425},{"team":"KA","placement":6,"probability":0.18275},{"team":"KA","placement":7,"probability":0.08775},{"team":"KA","placement":8,"probability":0.0515},{"team":"KA","placement":9,"probability":0.02775},{"team":"KA","placement":10,"probability":0.0085},{"team":"KA","placement":11,"probability":0.004},{"team":"KA","placement":12,"probability":0.00075},{"team":"Selfoss","placement":1,"probability":0},{"team":"Selfoss","placement":2,"probability":0},{"team":"Selfoss","placement":3,"probability":0.00025},{"team":"Selfoss","placement":4,"probability":0.0005},{"team":"Selfoss","placement":5,"probability":0.00675},{"team":"Selfoss","placement":6,"probability":0.014},{"team":"Selfoss","placement":7,"probability":0.0355},{"team":"Selfoss","placement":8,"probability":0.05875},{"team":"Selfoss","placement":9,"probability":0.09025},{"team":"Selfoss","placement":10,"probability":0.13475},{"team":"Selfoss","placement":11,"probability":0.19875},{"team":"Selfoss","placement":12,"probability":0.4605},{"team":"Stjarnan","placement":1,"probability":0},{"team":"Stjarnan","placement":2,"probability":0.00025},{"team":"Stjarnan","placement":3,"probability":0.0035},{"team":"Stjarnan","placement":4,"probability":0.01325},{"team":"Stjarnan","placement":5,"probability":0.04875},{"team":"Stjarnan","placement":6,"probability":0.1105},{"team":"Stjarnan","placement":7,"probability":0.15675},{"team":"Stjarnan","placement":8,"probability":0.16525},{"team":"Stjarnan","placement":9,"probability":0.175},{"team":"Stjarnan","placement":10,"probability":0.154},{"team":"Stjarnan","placement":11,"probability":0.1225},{"team":"Stjarnan","placement":12,"probability":0.05025},{"team":"Valur","placement":1,"probability":0.077},{"team":"Valur","placement":2,"probability":0.164},{"team":"Valur","placement":3,"probability":0.25025},{"team":"Valur","placement":4,"probability":0.29875},{"team":"Valur","placement":5,"probability":0.13275},{"team":"Valur","placement":6,"probability":0.05025},{"team":"Valur","placement":7,"probability":0.01925},{"team":"Valur","placement":8,"probability":0.00575},{"team":"Valur","placement":9,"probability":0.00125},{"team":"Valur","placement":10,"probability":0.00075},{"team":"Valur","placement":11,"probability":0},{"team":"Valur","placement":12,"probability":0},{"team":"Víkingur","placement":1,"probability":0},{"team":"Víkingur","placement":2,"probability":0},{"team":"Víkingur","placement":3,"probability":0.001},{"team":"Víkingur","placement":4,"probability":0.0035},{"team":"Víkingur","placement":5,"probability":0.018},{"team":"Víkingur","placement":6,"probability":0.05225},{"team":"Víkingur","placement":7,"probability":0.0845},{"team":"Víkingur","placement":8,"probability":0.104},{"team":"Víkingur","placement":9,"probability":0.12525},{"team":"Víkingur","placement":10,"probability":0.17375},{"team":"Víkingur","placement":11,"probability":0.214},{"team":"Víkingur","placement":12,"probability":0.22375},{"team":"ÍBV","placement":1,"probability":0.0005},{"team":"ÍBV","placement":2,"probability":0.00325},{"team":"ÍBV","placement":3,"probability":0.0205},{"team":"ÍBV","placement":4,"probability":0.06625},{"team":"ÍBV","placement":5,"probability":0.1565},{"team":"ÍBV","placement":6,"probability":0.25},{"team":"ÍBV","placement":7,"probability":0.18325},{"team":"ÍBV","placement":8,"probability":0.12975},{"team":"ÍBV","placement":9,"probability":0.0965},{"team":"ÍBV","placement":10,"probability":0.0525},{"team":"ÍBV","placement":11,"probability":0.03325},{"team":"ÍBV","placement":12,"probability":0.00775},{"team":"Þór","placement":1,"probability":0},{"team":"Þór","placement":2,"probability":0.0005},{"team":"Þór","placement":3,"probability":0.003},{"team":"Þór","placement":4,"probability":0.012},{"team":"Þór","placement":5,"probability":0.0435},{"team":"Þór","placement":6,"probability":0.092},{"team":"Þór","placement":7,"probability":0.14025},{"team":"Þór","placement":8,"probability":0.15975},{"team":"Þór","placement":9,"probability":0.161},{"team":"Þór","placement":10,"probability":0.16725},{"team":"Þór","placement":11,"probability":0.1385},{"team":"Þór","placement":12,"probability":0.08225}],"summary":[{"team":"Afturelding","p_top_of_table":0.09225},{"team":"FH","p_top_of_table":0.264},{"team":"Fram","p_top_of_table":0.00025},{"team":"HK","p_top_of_table":0},{"team":"Haukar","p_top_of_table":0.555},{"team":"KA","p_top_of_table":0.011},{"team":"Selfoss","p_top_of_table":0},{"team":"Stjarnan","p_top_of_table":0},{"team":"Valur","p_top_of_table":0.077},{"team":"Víkingur","p_top_of_table":0},{"team":"ÍBV","p_top_of_table":0.0005},{"team":"Þór","p_top_of_table":0}]}
