{"generated_at":"2026-10-31T12:40:27+0000","season":2027,"basis":"regular_season_table","n_teams":12,"records":[{"team":"Breiðablik","placement":1,"probability":0.003},{"team":"Breiðablik","placement":2,"probability":0.01875},{"team":"Breiðablik","placement":3,"probability":0.07825},{"team":"Breiðablik","placement":4,"probability":0.35375},{"team":"Breiðablik","placement":5,"probability":0.26675},{"team":"Breiðablik","placement":6,"probability":0.149},{"team":"Breiðablik","placement":7,"probability":0.0665},{"team":"Breiðablik","placement":8,"probability":0.0355},{"team":"Breiðablik","placement":9,"probability":0.018},{"team":"Breiðablik","placement":10,"probability":0.00875},{"team":"Breiðablik","placement":11,"probability":0.0015},{"team":"Breiðablik","placement":12,"probability":0.00025},{"team":"Fjölnir","placement":1,"probability":0},{"team":"Fjölnir","placement":2,"probability":0},{"team":"Fjölnir","placement":3,"probability":0.00025},{"team":"Fjölnir","placement":4,"probability":0.006},{"team":"Fjölnir","placement":5,"probability":0.0245},{"team":"Fjölnir","placement":6,"probability":0.06425},{"team":"Fjölnir","placement":7,"probability":0.101},{"team":"Fjölnir","placement":8,"probability":0.135},{"team":"Fjölnir","placement":9,"probability":0.1645},{"team":"Fjölnir","placement":10,"probability":0.1715},{"team":"Fjölnir","placement":11,"probability":0.17625},{"team":"Fjölnir","placement":12,"probability":0.15675},{"team":"Hamar","placement":1,"probability":0},{"team":"Hamar","placement":2,"probability":0.00025},{"team":"Hamar","placement":3,"probability":0.0005},{"team":"Hamar","placement":4,"probability":0.01},{"team":"Hamar","placement":5,"probability":0.03075},{"team":"Hamar","placement":6,"probability":0.074},{"team":"Hamar","placement":7,"probability":0.13975},{"team":"Hamar","placement":8,"probability":0.17575},{"team":"Hamar","placement":9,"probability":0.194},{"team":"Hamar","placement":10,"probability":0.17375},{"team":"Hamar","placement":11,"probability":0.1295},{"team":"Hamar","placement":12,"probability":0.07175},{"team":"Haukar","placement":1,"probability":0.14125},{"team":"Haukar","placement":2,"probability":0.24275},{"team":"Haukar","placement":3,"probability":0.4905},{"team":"Haukar","placement":4,"probability":0.09975},{"team":"Haukar","placement":5,"probability":0.02075},{"team":"Haukar","placement":6,"probability":0.0035},{"team":"Haukar","placement":7,"probability":0.0015},{"team":"Haukar","placement":8,"probability":0},{"team":"Haukar","placement":9,"probability":0},{"team":"Haukar","placement":10,"probability":0},{"team":"Haukar","placement":11,"probability":0},{"team":"Haukar","placement":12,"probability":0},{"team":"KFG","placement":1,"probability":0.00375},{"team":"KFG","placement":2,"probability":0.01525},{"team":"KFG","placement":3,"probability":0.051},{"team":"KFG","placement":4,"probability":0.2055},{"team":"KFG","placement":5,"probability":0.24675},{"team":"KFG","placement":6,"probability":0.206},{"team":"KFG","placement":7,"probability":0.1215},{"team":"KFG","placement":8,"probability":0.076},{"team":"KFG","placement":9,"probability":0.03725},{"team":"KFG","placement":10,"probability":0.02325},{"team":"KFG","placement":11,"probability":0.01125},{"team":"KFG","placement":12,"probability":0.0025},{"team":"KV","placement":1,"probability":0},{"team":"KV","placement":2,"probability":0.00025},{"team":"KV","placement":3,"probability":0.00225},{"team":"KV","placement":4,"probability":0.0335},{"team":"KV","placement":5,"probability":0.08675},{"team":"KV","placement":6,"probability":0.145},{"team":"KV","placement":7,"probability":0.225},{"team":"KV","placement":8,"probability":0.19675},{"team":"KV","placement":9,"probability":0.1375},{"team":"KV","placement":10,"probability":0.0955},{"team":"KV","placement":11,"probability":0.0545},{"team":"KV","placement":12,"probability":0.023},{"team":"Selfoss","placement":1,"probability":0.00025},{"team":"Selfoss","placement":2,"probability":0.002},{"team":"Selfoss","placement":3,"probability":0.021},{"team":"Selfoss","placement":4,"probability":0.22375},{"team":"Selfoss","placement":5,"probability":0.276},{"team":"Selfoss","placement":6,"probability":0.25225},{"team":"Selfoss","placement":7,"probability":0.11725},{"team":"Selfoss","placement":8,"probability":0.0585},{"team":"Selfoss","placement":9,"probability":0.03025},{"team":"Selfoss","placement":10,"probability":0.0125},{"team":"Selfoss","placement":11,"probability":0.0045},{"team":"Selfoss","placement":12,"probability":0.00175},{"team":"Skallagrímur","placement":1,"probability":0},{"team":"Skallagrímur","placement":2,"probability":0},{"team":"Skallagrímur","placement":3,"probability":0.00025},{"team":"Skallagrímur","placement":4,"probability":0.00825},{"team":"Skallagrímur","placement":5,"probability":0.03175},{"team":"Skallagrímur","placement":6,"probability":0.07125},{"team":"Skallagrímur","placement":7,"probability":0.141},{"team":"Skallagrímur","placement":8,"probability":0.162},{"team":"Skallagrímur","placement":9,"probability":0.17},{"team":"Skallagrímur","placement":10,"probability":0.1615},{"team":"Skallagrímur","placement":11,"probability":0.1405},{"team":"Skallagrímur","placement":12,"probability":0.1135},{"team":"Snæfell","placement":1,"probability":0},{"team":"Snæfell","placement":2,"probability":0},{"team":"Snæfell","placement":3,"probability":0},{"team":"Snæfell","placement":4,"probability":0.00025},{"team":"Snæfell","placement":5,"probability":0.00225},{"team":"Snæfell","placement":6,"probability":0.015},{"team":"Snæfell","placement":7,"probability":0.04625},{"team":"Snæfell","placement":8,"probability":0.08825},{"team":"Snæfell","placement":9,"probability":0.13275},{"team":"Snæfell","placement":10,"probability":0.19025},{"team":"Snæfell","placement":11,"probability":0.23925},{"team":"Snæfell","placement":12,"probability":0.28575},{"team":"ÍA","placement":1,"probability":0.586},{"team":"ÍA","placement":2,"probability":0.26325},{"team":"ÍA","placement":3,"probability":0.12025},{"team":"ÍA","placement":4,"probability":0.024},{"team":"ÍA","placement":5,"probability":0.0045},{"team":"ÍA","placement":6,"probability":0.00175},{"team":"ÍA","placement":7,"probability":0.00025},{"team":"ÍA","placement":8,"probability":0},{"team":"ÍA","placement":9,"probability":0},{"team":"ÍA","placement":10,"probability":0},{"team":"ÍA","placement":11,"probability":0},{"team":"ÍA","placement":12,"probability":0},{"team":"Þór Ak.","placement":1,"probability":0},{"team":"Þór Ak.","placement":2,"probability":0},{"team":"Þór Ak.","placement":3,"probability":0},{"team":"Þór Ak.","placement":4,"probability":0.0005},{"team":"Þór Ak.","placement":5,"probability":0.0045},{"team":"Þór Ak.","placement":6,"probability":0.0165},{"team":"Þór Ak.","placement":7,"probability":0.04},{"team":"Þór Ak.","placement":8,"probability":0.07225},{"team":"Þór Ak.","placement":9,"probability":0.11575},{"team":"Þór Ak.","placement":10,"probability":0.163},{"team":"Þór Ak.","placement":11,"probability":0.24275},{"team":"Þór Ak.","placement":12,"probability":0.34475},{"team":"Þór Þ.","placement":1,"probability":0.26575},{"team":"Þór Þ.","placement":2,"probability":0.4575},{"team":"Þór Þ.","placement":3,"probability":0.23575},{"team":"Þór Þ.","placement":4,"probability":0.03475},{"team":"Þór Þ.","placement":5,"probability":0.00475},{"team":"Þór Þ.","placement":6,"probability":0.0015},{"team":"Þór Þ.","placement":7,"probability":0},{"team":"Þór Þ.","placement":8,"probability":0},{"team":"Þór Þ.","placement":9,"probability":0},{"team":"Þór Þ.","placement":10,"probability":0},{"team":"Þór Þ.","placement":11,"probability":0},{"team":"Þór Þ.","placement":12,"probability":0}],"summary":[{"team":"Breiðablik","p_top_of_table":0.003},{"team":"Fjölnir","p_top_of_table":0},{"team":"Hamar","p_top_of_table":0},{"team":"Haukar","p_top_of_table":0.14125},{"team":"KFG","p_top_of_table":0.00375},{"team":"KV","p_top_of_table":0},{"team":"Selfoss","p_top_of_table":0.00025},{"team":"Skallagrímur","p_top_of_table":0},{"team":"Snæfell","p_top_of_table":0},{"team":"ÍA","p_top_of_table":0.586},{"team":"Þór Ak.","p_top_of_table":0},{"team":"Þór Þ.","p_top_of_table":0.26575}]}
