{"generated_at":"2026-10-26T21:43:14+0000","season":2027,"basis":"regular_season_table","n_teams":8,"records":[{"team":"Afturelding","placement":1,"probability":0.65825},{"team":"Afturelding","placement":2,"probability":0.2895},{"team":"Afturelding","placement":3,"probability":0.04575},{"team":"Afturelding","placement":4,"probability":0.00575},{"team":"Afturelding","placement":5,"probability":0.00075},{"team":"Afturelding","placement":6,"probability":0},{"team":"Afturelding","placement":7,"probability":0},{"team":"Afturelding","placement":8,"probability":0},{"team":"FH","placement":1,"probability":0.2995},{"team":"FH","placement":2,"probability":0.49125},{"team":"FH","placement":3,"probability":0.1755},{"team":"FH","placement":4,"probability":0.02825},{"team":"FH","placement":5,"probability":0.0055},{"team":"FH","placement":6,"probability":0},{"team":"FH","placement":7,"probability":0},{"team":"FH","placement":8,"probability":0},{"team":"Fjölnir","placement":1,"probability":0.0025},{"team":"Fjölnir","placement":2,"probability":0.02875},{"team":"Fjölnir","placement":3,"probability":0.17975},{"team":"Fjölnir","placement":4,"probability":0.461},{"team":"Fjölnir","placement":5,"probability":0.203},{"team":"Fjölnir","placement":6,"probability":0.087},{"team":"Fjölnir","placement":7,"probability":0.03725},{"team":"Fjölnir","placement":8,"probability":0.00075},{"team":"Fram 2","placement":1,"probability":0},{"team":"Fram 2","placement":2,"probability":0.00275},{"team":"Fram 2","placement":3,"probability":0.026},{"team":"Fram 2","placement":4,"probability":0.147},{"team":"Fram 2","placement":5,"probability":0.27475},{"team":"Fram 2","placement":6,"probability":0.27725},{"team":"Fram 2","placement":7,"probability":0.25975},{"team":"Fram 2","placement":8,"probability":0.0125},{"team":"Grótta 2","placement":1,"probability":0},{"team":"Grótta 2","placement":2,"probability":0},{"team":"Grótta 2","placement":3,"probability":0},{"team":"Grótta 2","placement":4,"probability":0.00025},{"team":"Grótta 2","placement":5,"probability":0.001},{"team":"Grótta 2","placement":6,"probability":0.00525},{"team":"Grótta 2","placement":7,"probability":0.04},{"team":"Grótta 2","placement":8,"probability":0.9535},{"team":"HK 2","placement":1,"probability":0},{"team":"HK 2","placement":2,"probability":0.00125},{"team":"HK 2","placement":3,"probability":0.018},{"team":"HK 2","placement":4,"probability":0.10625},{"team":"HK 2","placement":5,"probability":0.28},{"team":"HK 2","placement":6,"probability":0.2895},{"team":"HK 2","placement":7,"probability":0.28525},{"team":"HK 2","placement":8,"probability":0.01975},{"team":"Valur 2","placement":1,"probability":0},{"team":"Valur 2","placement":2,"probability":0.0005},{"team":"Valur 2","placement":3,"probability":0.0075},{"team":"Valur 2","placement":4,"probability":0.07425},{"team":"Valur 2","placement":5,"probability":0.19575},{"team":"Valur 2","placement":6,"probability":0.332},{"team":"Valur 2","placement":7,"probability":0.3765},{"team":"Valur 2","placement":8,"probability":0.0135},{"team":"Víkingur","placement":1,"probability":0.03975},{"team":"Víkingur","placement":2,"probability":0.186},{"team":"Víkingur","placement":3,"probability":0.5475},{"team":"Víkingur","placement":4,"probability":0.17725},{"team":"Víkingur","placement":5,"probability":0.03925},{"team":"Víkingur","placement":6,"probability":0.009},{"team":"Víkingur","placement":7,"probability":0.00125},{"team":"Víkingur","placement":8,"probability":0}],"summary":[{"team":"Afturelding","p_top_of_table":0.65825},{"team":"FH","p_top_of_table":0.2995},{"team":"Fjölnir","p_top_of_table":0.0025},{"team":"Fram 2","p_top_of_table":0},{"team":"Grótta 2","p_top_of_table":0},{"team":"HK 2","p_top_of_table":0},{"team":"Valur 2","p_top_of_table":0},{"team":"Víkingur","p_top_of_table":0.03975}]}
