{"generated_at":"2026-10-18T12:42:42+0000","season":2027,"basis":"regular_season_table","n_teams":10,"records":[{"team":"Fram","placement":1,"probability":0.02825},{"team":"Fram","placement":2,"probability":0.0735},{"team":"Fram","placement":3,"probability":0.177},{"team":"Fram","placement":4,"probability":0.3955},{"team":"Fram","placement":5,"probability":0.24975},{"team":"Fram","placement":6,"probability":0.0565},{"team":"Fram","placement":7,"probability":0.01375},{"team":"Fram","placement":8,"probability":0.00325},{"team":"Fram","placement":9,"probability":0.0015},{"team":"Fram","placement":10,"probability":0.001},{"team":"Grótta","placement":1,"probability":0},{"team":"Grótta","placement":2,"probability":0},{"team":"Grótta","placement":3,"probability":0.00325},{"team":"Grótta","placement":4,"probability":0.00775},{"team":"Grótta","placement":5,"probability":0.03275},{"team":"Grótta","placement":6,"probability":0.15125},{"team":"Grótta","placement":7,"probability":0.21375},{"team":"Grótta","placement":8,"probability":0.22325},{"team":"Grótta","placement":9,"probability":0.20325},{"team":"Grótta","placement":10,"probability":0.16475},{"team":"HK","placement":1,"probability":0},{"team":"HK","placement":2,"probability":0},{"team":"HK","placement":3,"probability":0.00175},{"team":"HK","placement":4,"probability":0.00775},{"team":"HK","placement":5,"probability":0.04525},{"team":"HK","placement":6,"probability":0.14125},{"team":"HK","placement":7,"probability":0.1915},{"team":"HK","placement":8,"probability":0.1975},{"team":"HK","placement":9,"probability":0.20025},{"team":"HK","placement":10,"probability":0.21475},{"team":"Haukar","placement":1,"probability":0.513},{"team":"Haukar","placement":2,"probability":0.25325},{"team":"Haukar","placement":3,"probability":0.162},{"team":"Haukar","placement":4,"probability":0.058},{"team":"Haukar","placement":5,"probability":0.01325},{"team":"Haukar","placement":6,"probability":0.0005},{"team":"Haukar","placement":7,"probability":0},{"team":"Haukar","placement":8,"probability":0},{"team":"Haukar","placement":9,"probability":0},{"team":"Haukar","placement":10,"probability":0},{"team":"KA/Þór","placement":1,"probability":0},{"team":"KA/Þór","placement":2,"probability":0},{"team":"KA/Þór","placement":3,"probability":0},{"team":"KA/Þór","placement":4,"probability":0.00375},{"team":"KA/Þór","placement":5,"probability":0.02675},{"team":"KA/Þór","placement":6,"probability":0.1225},{"team":"KA/Þór","placement":7,"probability":0.16325},{"team":"KA/Þór","placement":8,"probability":0.19725},{"team":"KA/Þór","placement":9,"probability":0.2195},{"team":"KA/Þór","placement":10,"probability":0.267},{"team":"Selfoss","placement":1,"probability":0.0005},{"team":"Selfoss","placement":2,"probability":0.0005},{"team":"Selfoss","placement":3,"probability":0.0085},{"team":"Selfoss","placement":4,"probability":0.03825},{"team":"Selfoss","placement":5,"probability":0.12975},{"team":"Selfoss","placement":6,"probability":0.2735},{"team":"Selfoss","placement":7,"probability":0.20975},{"team":"Selfoss","placement":8,"probability":0.143},{"team":"Selfoss","placement":9,"probability":0.11875},{"team":"Selfoss","placement":10,"probability":0.0775},{"team":"Stjarnan","placement":1,"probability":0},{"team":"Stjarnan","placement":2,"probability":0},{"team":"Stjarnan","placement":3,"probability":0.00075},{"team":"Stjarnan","placement":4,"probability":0.00275},{"team":"Stjarnan","placement":5,"probability":0.019},{"team":"Stjarnan","placement":6,"probability":0.08325},{"team":"Stjarnan","placement":7,"probability":0.154},{"team":"Stjarnan","placement":8,"probability":0.21525},{"team":"Stjarnan","placement":9,"probability":0.25125},{"team":"Stjarnan","placement":10,"probability":0.27375},{"team":"Valur","placement":1,"probability":0.2335},{"team":"Valur","placement":2,"probability":0.389},{"team":"Valur","placement":3,"probability":0.254},{"team":"Valur","placement":4,"probability":0.096},{"team":"Valur","placement":5,"probability":0.0225},{"team":"Valur","placement":6,"probability":0.00425},{"team":"Valur","placement":7,"probability":0.00075},{"team":"Valur","placement":8,"probability":0},{"team":"Valur","placement":9,"probability":0},{"team":"Valur","placement":10,"probability":0},{"team":"ÍBV","placement":1,"probability":0.218},{"team":"ÍBV","placement":2,"probability":0.25575},{"team":"ÍBV","placement":3,"probability":0.31475},{"team":"ÍBV","placement":4,"probability":0.15325},{"team":"ÍBV","placement":5,"probability":0.0495},{"team":"ÍBV","placement":6,"probability":0.0065},{"team":"ÍBV","placement":7,"probability":0.00225},{"team":"ÍBV","placement":8,"probability":0},{"team":"ÍBV","placement":9,"probability":0},{"team":"ÍBV","placement":10,"probability":0},{"team":"ÍR","placement":1,"probability":0.00675},{"team":"ÍR","placement":2,"probability":0.028},{"team":"ÍR","placement":3,"probability":0.078},{"team":"ÍR","placement":4,"probability":0.237},{"team":"ÍR","placement":5,"probability":0.4115},{"team":"ÍR","placement":6,"probability":0.1605},{"team":"ÍR","placement":7,"probability":0.051},{"team":"ÍR","placement":8,"probability":0.0205},{"team":"ÍR","placement":9,"probability":0.0055},{"team":"ÍR","placement":10,"probability":0.00125}],"summary":[{"team":"Fram","p_top_of_table":0.02825},{"team":"Grótta","p_top_of_table":0},{"team":"HK","p_top_of_table":0},{"team":"Haukar","p_top_of_table":0.513},{"team":"KA/Þór","p_top_of_table":0},{"team":"Selfoss","p_top_of_table":0.0005},{"team":"Stjarnan","p_top_of_table":0},{"team":"Valur","p_top_of_table":0.2335},{"team":"ÍBV","p_top_of_table":0.218},{"team":"ÍR","p_top_of_table":0.00675}]}
