{"generated_at":"2026-10-20T23:16:48+0000","season":2027,"basis":"regular_season_table","n_teams":12,"records":[{"team":"Fjölnir","placement":1,"probability":0},{"team":"Fjölnir","placement":2,"probability":0.00125},{"team":"Fjölnir","placement":3,"probability":0.18925},{"team":"Fjölnir","placement":4,"probability":0.25725},{"team":"Fjölnir","placement":5,"probability":0.2335},{"team":"Fjölnir","placement":6,"probability":0.162},{"team":"Fjölnir","placement":7,"probability":0.0965},{"team":"Fjölnir","placement":8,"probability":0.039},{"team":"Fjölnir","placement":9,"probability":0.01675},{"team":"Fjölnir","placement":10,"probability":0.00375},{"team":"Fjölnir","placement":11,"probability":0.00075},{"team":"Fjölnir","placement":12,"probability":0},{"team":"Fram 2","placement":1,"probability":0},{"team":"Fram 2","placement":2,"probability":0},{"team":"Fram 2","placement":3,"probability":0},{"team":"Fram 2","placement":4,"probability":0.00075},{"team":"Fram 2","placement":5,"probability":0.0015},{"team":"Fram 2","placement":6,"probability":0.008},{"team":"Fram 2","placement":7,"probability":0.016},{"team":"Fram 2","placement":8,"probability":0.04925},{"team":"Fram 2","placement":9,"probability":0.095},{"team":"Fram 2","placement":10,"probability":0.21025},{"team":"Fram 2","placement":11,"probability":0.49575},{"team":"Fram 2","placement":12,"probability":0.1235},{"team":"Grótta","placement":1,"probability":0.71575},{"team":"Grótta","placement":2,"probability":0.2795},{"team":"Grótta","placement":3,"probability":0.0045},{"team":"Grótta","placement":4,"probability":0.00025},{"team":"Grótta","placement":5,"probability":0},{"team":"Grótta","placement":6,"probability":0},{"team":"Grótta","placement":7,"probability":0},{"team":"Grótta","placement":8,"probability":0},{"team":"Grótta","placement":9,"probability":0},{"team":"Grótta","placement":10,"probability":0},{"team":"Grótta","placement":11,"probability":0},{"team":"Grótta","placement":12,"probability":0},{"team":"HK 2","placement":1,"probability":0},{"team":"HK 2","placement":2,"probability":0},{"team":"HK 2","placement":3,"probability":0.0065},{"team":"HK 2","placement":4,"probability":0.0265},{"team":"HK 2","placement":5,"probability":0.04425},{"team":"HK 2","placement":6,"probability":0.10275},{"team":"HK 2","placement":7,"probability":0.18725},{"team":"HK 2","placement":8,"probability":0.23875},{"team":"HK 2","placement":9,"probability":0.2115},{"team":"HK 2","placement":10,"probability":0.134},{"team":"HK 2","placement":11,"probability":0.04675},{"team":"HK 2","placement":12,"probability":0.00175},{"team":"Haukar 2","placement":1,"probability":0},{"team":"Haukar 2","placement":2,"probability":0.0035},{"team":"Haukar 2","placement":3,"probability":0.2055},{"team":"Haukar 2","placement":4,"probability":0.23575},{"team":"Haukar 2","placement":5,"probability":0.22025},{"team":"Haukar 2","placement":6,"probability":0.16},{"team":"Haukar 2","placement":7,"probability":0.09275},{"team":"Haukar 2","placement":8,"probability":0.05525},{"team":"Haukar 2","placement":9,"probability":0.01825},{"team":"Haukar 2","placement":10,"probability":0.00775},{"team":"Haukar 2","placement":11,"probability":0.001},{"team":"Haukar 2","placement":12,"probability":0},{"team":"Hvíti Riddarinn","placement":1,"probability":0},{"team":"Hvíti Riddarinn","placement":2,"probability":0},{"team":"Hvíti Riddarinn","placement":3,"probability":0.007},{"team":"Hvíti Riddarinn","placement":4,"probability":0.028},{"team":"Hvíti Riddarinn","placement":5,"probability":0.059},{"team":"Hvíti Riddarinn","placement":6,"probability":0.1125},{"team":"Hvíti Riddarinn","placement":7,"probability":0.1915},{"team":"Hvíti Riddarinn","placement":8,"probability":0.20925},{"team":"Hvíti Riddarinn","placement":9,"probability":0.17425},{"team":"Hvíti Riddarinn","placement":10,"probability":0.1495},{"team":"Hvíti Riddarinn","placement":11,"probability":0.0635},{"team":"Hvíti Riddarinn","placement":12,"probability":0.0055},{"team":"Hörður","placement":1,"probability":0},{"team":"Hörður","placement":2,"probability":0},{"team":"Hörður","placement":3,"probability":0.00825},{"team":"Hörður","placement":4,"probability":0.023},{"team":"Hörður","placement":5,"probability":0.04275},{"team":"Hörður","placement":6,"probability":0.088},{"team":"Hörður","placement":7,"probability":0.1465},{"team":"Hörður","placement":8,"probability":0.18075},{"team":"Hörður","placement":9,"probability":0.2095},{"team":"Hörður","placement":10,"probability":0.17375},{"team":"Hörður","placement":11,"probability":0.1185},{"team":"Hörður","placement":12,"probability":0.009},{"team":"Selfoss 2","placement":1,"probability":0.0015},{"team":"Selfoss 2","placement":2,"probability":0.01175},{"team":"Selfoss 2","placement":3,"probability":0.4705},{"team":"Selfoss 2","placement":4,"probability":0.23175},{"team":"Selfoss 2","placement":5,"probability":0.152},{"team":"Selfoss 2","placement":6,"probability":0.07925},{"team":"Selfoss 2","placement":7,"probability":0.0355},{"team":"Selfoss 2","placement":8,"probability":0.0145},{"team":"Selfoss 2","placement":9,"probability":0.0025},{"team":"Selfoss 2","placement":10,"probability":0.00075},{"team":"Selfoss 2","placement":11,"probability":0},{"team":"Selfoss 2","placement":12,"probability":0},{"team":"Valur 2","placement":1,"probability":0},{"team":"Valur 2","placement":2,"probability":0.00025},{"team":"Valur 2","placement":3,"probability":0.09225},{"team":"Valur 2","placement":4,"probability":0.18675},{"team":"Valur 2","placement":5,"probability":0.2215},{"team":"Valur 2","placement":6,"probability":0.238},{"team":"Valur 2","placement":7,"probability":0.14075},{"team":"Valur 2","placement":8,"probability":0.067},{"team":"Valur 2","placement":9,"probability":0.03525},{"team":"Valur 2","placement":10,"probability":0.01575},{"team":"Valur 2","placement":11,"probability":0.00225},{"team":"Valur 2","placement":12,"probability":0.00025},{"team":"Víkingur 2","placement":1,"probability":0},{"team":"Víkingur 2","placement":2,"probability":0},{"team":"Víkingur 2","placement":3,"probability":0.00325},{"team":"Víkingur 2","placement":4,"probability":0.0095},{"team":"Víkingur 2","placement":5,"probability":0.02525},{"team":"Víkingur 2","placement":6,"probability":0.0495},{"team":"Víkingur 2","placement":7,"probability":0.09275},{"team":"Víkingur 2","placement":8,"probability":0.14425},{"team":"Víkingur 2","placement":9,"probability":0.23175},{"team":"Víkingur 2","placement":10,"probability":0.27575},{"team":"Víkingur 2","placement":11,"probability":0.1495},{"team":"Víkingur 2","placement":12,"probability":0.0185},{"team":"Víðir","placement":1,"probability":0},{"team":"Víðir","placement":2,"probability":0},{"team":"Víðir","placement":3,"probability":0},{"team":"Víðir","placement":4,"probability":0},{"team":"Víðir","placement":5,"probability":0},{"team":"Víðir","placement":6,"probability":0},{"team":"Víðir","placement":7,"probability":0.0005},{"team":"Víðir","placement":8,"probability":0.002},{"team":"Víðir","placement":9,"probability":0.00525},{"team":"Víðir","placement":10,"probability":0.02875},{"team":"Víðir","placement":11,"probability":0.122},{"team":"Víðir","placement":12,"probability":0.8415},{"team":"ÍR","placement":1,"probability":0.28275},{"team":"ÍR","placement":2,"probability":0.70375},{"team":"ÍR","placement":3,"probability":0.013},{"team":"ÍR","placement":4,"probability":0.0005},{"team":"ÍR","placement":5,"probability":0},{"team":"ÍR","placement":6,"probability":0},{"team":"ÍR","placement":7,"probability":0},{"team":"ÍR","placement":8,"probability":0},{"team":"ÍR","placement":9,"probability":0},{"team":"ÍR","placement":10,"probability":0},{"team":"ÍR","placement":11,"probability":0},{"team":"ÍR","placement":12,"probability":0}],"summary":[{"team":"Fjölnir","p_top_of_table":0},{"team":"Fram 2","p_top_of_table":0},{"team":"Grótta","p_top_of_table":0.71575},{"team":"HK 2","p_top_of_table":0},{"team":"Haukar 2","p_top_of_table":0},{"team":"Hvíti Riddarinn","p_top_of_table":0},{"team":"Hörður","p_top_of_table":0},{"team":"Selfoss 2","p_top_of_table":0.0015},{"team":"Valur 2","p_top_of_table":0},{"team":"Víkingur 2","p_top_of_table":0},{"team":"Víðir","p_top_of_table":0},{"team":"ÍR","p_top_of_table":0.28275}]}
